{"$id":"KDEN_V375_PREFIT_PASS_V1","$schema":"https://json-schema.org/draft/2020-12/schema","additionalProperties":false,"properties":{"artifact_hashes":{"type":"object"},"authority_hashes":{"type":"object"},"completed_at_utc":{"format":"date-time","type":"string"},"gate_evidence":{"type":"object"},"predecessor_hashes":{"type":"object"},"record_sha256":{"pattern":"^[0-9a-f]{64}$","type":"string"},"run_id":{"pattern":"^kdenv375-p0[1-7]-(ordinary|diagnostic|owner-full|validation|synthetic)-[0-9]{8}T[0-9]{6}Z-[a-z0-9][a-z0-9-]{0,31}$","type":"string"},"schema_version":{"const":"KDEN_V375_PREFIT_PASS_V1"},"stage_id":{"pattern":"^PREFIT_P0[1-7]$","type":"string"},"status":{"const":"PASS"}},"required":["schema_version","stage_id","status","completed_at_utc","run_id","predecessor_hashes","authority_hashes","artifact_hashes","gate_evidence","record_sha256"],"type":"object"}
