{"artifact_hashes":{"config/prefit/p05_materialization_v375.json":"c8ea1f2335633fdf75d7cfc5fe44ed15dde3ed579b418224ab8d6a9d9510c8bf","prefit_runs/kdenv375-p05-owner-full-20260924T030717Z-universal-substrate/p05/progress/completions.jsonl":"11a976955b9476aac158ab730ed8be062a1059dba24d9a87b04275c07b5ffc0d","prefit_runs/kdenv375-p05-owner-full-20260924T030717Z-universal-substrate/p05/year_manifests":"adc3f12d2bd06a492736311d22397f0849ad30107d662c8c0ab8c47c90e8e71a","reports/prefit/P05_MATERIALIZATION_REPORT.md":"b1a8ee03f4eee2d59c7a592e40a62fedf3fe801827248047f21f0da0303e5cde","reports/prefit/P05_OWNER_RUNBOOK.md":"e2afb32bb198baddf9159be6137dca0cc0745b671c4b823a6a0a0442cdcd5f70","schemas/prefit/p05_release_manifest_v375.json":"ff39e39c7940bf115ad26fc34a7b82c6425532b72155ef32f726d3e973067a36","schemas/prefit/p05_run_state_v375.json":"5dd21462f1d7473143a69e378520fdae1a1e974bcda0f2eec4c1886d99f6ac7b","schemas/prefit/trajectory_catalog_v375.json":"a4c8abbe33d64089f71a4f0f73004c8a769e8ebda3772c3e1b67be64f450ae74","src/kden_v375/prefit/cli.py":"35557fd4377d4ba9f4cc78f93b341306ceb897fb065d0d3d58975e74aabbe761","src/kden_v375/prefit/p05_materialization.py":"9bf88e0c8d9f37f435bed197d41d8e274050fb28c5afae313431fae3b92546fb","universal_issue_state/v1/deterministic_features/target_year=2021/part-2021.parquet":"b5598d70562a5ab5c6625fdbde9df00d383fb33f5578f95f3d992642581be883","universal_issue_state/v1/deterministic_features/target_year=2022/part-2022.parquet":"94afc13c66542d1027944dadf8e475c3c54275fff28d5e46a5ba8830948eab53","universal_issue_state/v1/deterministic_features/target_year=2023/part-2023.parquet":"758cbe2f015e225437803f6ecaa4ef1fb02799395f1cc8fa4096e2cc611552b2","universal_issue_state/v1/deterministic_features/target_year=2024/part-2024.parquet":"89e805e3d7014852bfedad0728e0bd630841ebcc7a2f9e7e0aa681c6a3fbefb3","universal_issue_state/v1/deterministic_features/target_year=2025/part-2025.parquet":"3ec36d74d63d943416de1c1b820acf09fd8e45c46d1cdb6e2e50a3890ff4787d","universal_issue_state/v1/deterministic_features/target_year=2026/part-2026.parquet":"e9d9df830eb7d3c8197262a776d415780c8b4bdce40cc5187a0ceff01bef39fc","universal_issue_state/v1/manifests/p05_release_manifest.json":"c0bf854800ee96cb29aaea4ebb3e196ec9c07fcc4b494b2cf0491dee917d6fe8","universal_issue_state/v1/release_index.json":"2218778725039c956f739d116810b9cc89b5354a31adf61cbe359e3ceeb608f4","universal_issue_state/v1/trajectory_catalog/static/h14.parquet":"8b3bdbea21bb342487798d235fefa239a339d057c8c6d951a8e47eac0267e15f","universal_issue_state/v1/trajectory_catalog/target_year=2021/part-2021.parquet":"40ef5ed2b893c909cbb1e6003ae30c0ed60604ab569862760efd7259b8cacd7f","universal_issue_state/v1/trajectory_catalog/target_year=2022/part-2022.parquet":"380be7b225062d890fb5506081c8e43bd2e9c9f820c6de26721d55763aeed651","universal_issue_state/v1/trajectory_catalog/target_year=2023/part-2023.parquet":"18ff0854d2345ec85683c35ebf3f1b1f623f3224be5092df824e3e35c462f852","universal_issue_state/v1/trajectory_catalog/target_year=2024/part-2024.parquet":"c3f1ced3f188ffe9aa3bf8962b81528f52537209753e4b25bbc9b04634befad1","universal_issue_state/v1/trajectory_catalog/target_year=2025/part-2025.parquet":"c139793fc8c494a04f7fd97ffd911915c70621e294b8ea39c719175fa1df99f5","universal_issue_state/v1/trajectory_catalog/target_year=2026/part-2026.parquet":"96fbd7271283677aa678687e6349b9e8dbfd9fbd179f0313a0bfbd611591d4cf"},"authority_hashes":{"P03_ISSUE_SPINE":"c23c7276d9dea07511d58794b444c278d550bf87c74c9b6126ef91d431287b29","P03_SELECTED_CYCLES":"4e65220bb91480c660cdbd073cdbe99bb08938fd8e65f29bcfdb2e099977ff0e","P04_FEATURE_REGISTRY":"e41d78a122be15a01986f0b914518209843108062313d7d55f62e308d37aaf65","P05_RELEASE_INDEX":"2218778725039c956f739d116810b9cc89b5354a31adf61cbe359e3ceeb608f4","P05_RELEASE_MANIFEST":"c0bf854800ee96cb29aaea4ebb3e196ec9c07fcc4b494b2cf0491dee917d6fe8"},"completed_at_utc":"2026-09-24T07:41:47.261735Z","gate_evidence":{"feature_row_count":118536,"minimum_free_bytes_at_start":8589934592,"model_fits_performed":0,"network_requests_made":0,"predecessor_record_sha256":"70515a2e73fbe0cef9775d01a566fbbd03f10e81978de3d96a728e4615227dc2","release_id":"KDEN_V375_UNIVERSAL_ISSUE_STATE_V1","runtime_isolation":{"absolute_user_paths_found":0,"denied_import_prefixes":["kden35","kden_panel"],"legacy_runtime_references_found":0,"package_root":"src/kden_v375"},"target_day_count":2080,"target_year_partition_count":6,"trajectory_dynamic_row_count":8919597,"trajectory_missing_row_count":12,"trajectory_reference_only":true,"trajectory_static_row_count":1,"trajectory_total_row_count":8919598,"truth_value_rows_read":0},"predecessor_hashes":{"PREFIT_P04":"70515a2e73fbe0cef9775d01a566fbbd03f10e81978de3d96a728e4615227dc2"},"record_sha256":"7e1366d32972aa492ae1064c354bfb0261401f59a16e16a26e12a65df96c4132","run_id":"kdenv375-p05-owner-full-20260924T030717Z-universal-substrate","schema_version":"KDEN_V375_PREFIT_PASS_V1","stage_id":"PREFIT_P05","status":"PASS"}
