{"artifact_hashes":{"config/prefit/p03_issue_spine_v375.json":"324c3f47304d8f63ac2de7b303e0944d9c115cbd82a0fbe031ee619eeefb86bf","reports/prefit/P03_ISSUE_SPINE_COVERAGE_DST_REPORT.md":"f62671a142c772332482458976858d5f1d01e4a0abb54645d556395b65ba8ff0","reports/prefit/P03_OWNER_RUNBOOK.md":"180e2a3ec192912fcfdcc89cefc9327e63ec7ea50a1ad97dc18c66ea435f4f07","schemas/prefit/issue_spine_v375.json":"f008bf790b66f52af976ff64542865156a24ae77eabd0e83cdccbb6484a22697","schemas/prefit/p03_run_state_v375.json":"3ad8a22b3e02229a62874b0efbe2fea439a154e746e7e27e73b530d0f2485ca2","schemas/prefit/p03_selection_manifest_v375.json":"7465ec0261f39258c4a78f1637565c8af9a0720b98934b37cf8c0ffb0d7ac9d6","schemas/prefit/selected_cycles_v375.json":"85ff581d8f42e93c2a48db811ae4d164a1cfbefbf4c9f3a097316b99227ac367","src/kden_v375/prefit/p03_issue_spine.py":"96cb6b288dba1112146bc36cad692fc4e013a32d40de24391439886497a00704","universal_issue_state/v1/issue_spine":"7ae5d6238553fd920b204fa5902c11db1123db4b4b8abe86d4724e8b469857f2","universal_issue_state/v1/manifests/p03_selection_manifest.json":"0e629e0b449359fee4d0a56d66bc487e6fcbd04c4c8416f04a851a6247d6d50e","universal_issue_state/v1/selected_cycles":"8f418f786d0fe0ffd1ef2c8824cf80fa41d9fefda122e755a163b16421d43670"},"authority_hashes":{"ISSUE_SPINE":"c23c7276d9dea07511d58794b444c278d550bf87c74c9b6126ef91d431287b29","R14_CYCLE_SCHEDULE":"7f6676d802137faba08000e2a2f93ff21079283de41246d3e3d46d894ead6f45","R14_CYCLE_SCHEDULE_MANIFEST":"3c0ae6db4290a01a190d23492349df61593d4d44a006c2094660497d0c013e55","SELECTED_CYCLES":"4e65220bb91480c660cdbd073cdbe99bb08938fd8e65f29bcfdb2e099977ff0e"},"completed_at_utc":"2026-09-23T23:05:51.507941Z","gate_evidence":{"current_cycle_missing_count":0,"issue_rows_per_target_day":{"53":6,"57":2074},"issue_state_count":118536,"network_requests_made":0,"predecessor_record_sha256":"40ff18bbac4c927ae600fd54026671493f4e68e5e0d65cdf07374965837cf607","previous_cycle_missing_count":0,"runtime_isolation":{"absolute_user_paths_found":0,"denied_import_prefixes":["kden35","kden_panel"],"legacy_runtime_references_found":0,"package_root":"src/kden_v375"},"schedule":{"schedule_id":"KDEN_V375_R14_CYCLE_SCHEDULE_20210101_20260911_V1","schedule_logical_sha256":"4fba37b93e527386e599cd62fa8de22123b6bf5e1d61462f0c4addea666c9eb5","schedule_manifest_path":"hrrr_v4_local_archive/common/cycle_schedule_r14/cycle_schedule_r14_v375_manifest.json","schedule_manifest_sha256":"3c0ae6db4290a01a190d23492349df61593d4d44a006c2094660497d0c013e55","schedule_path":"hrrr_v4_local_archive/common/cycle_schedule_r14/cycle_schedule_r14_v375.parquet","schedule_row_count":66558,"schedule_sha256":"7f6676d802137faba08000e2a2f93ff21079283de41246d3e3d46d894ead6f45"},"selected_cycle_row_count":237072,"selection_status_counts":{"SELECTED":237072},"spring_forward_target_days":["2021-03-14","2022-03-13","2023-03-12","2024-03-10","2025-03-09","2026-03-08"],"target_day_count":2080,"trajectory_bundle_missing_count":0,"truth_value_rows_read":0,"weather_value_rows_read":0},"predecessor_hashes":{"PREFIT_P02":"40ff18bbac4c927ae600fd54026671493f4e68e5e0d65cdf07374965837cf607"},"record_sha256":"c1201500ecfd5ed6eac60d45889c4b7ecdd2620c76998c00a1769531c9479f3b","run_id":"kdenv375-p03-owner-full-20260923T225640Z-issue-spine","schema_version":"KDEN_V375_PREFIT_PASS_V1","stage_id":"PREFIT_P03","status":"PASS"}
