{"artifact_hashes":{"config/prefit/p01_foundation_v375.json":"9799a059c9dcd4c52737c87daa36ba45a7af2cbc5c0fd776730b585aa7c2e262","environment/prefit/v1/build-requirements.lock":"1ac318d288530f12790ac6c5c39385e5464510dc1ac6a6f9e5dbf3e5b262ff74","environment/prefit/v1/environment.json":"cc6c378ce6141cbd2ea271484f0c054c8f813b4de1f5e0548d8cf4597f3f630f","environment/prefit/v1/requirements.lock":"694a338ad6276028afb710c90ececae504006fc7d1d0cbc2d0e2d9a00f5182b7","reports/prefit/P01_FOUNDATION_DECISION_REPORT.md":"5844c9cd37cc81215ca87e4439f6e95500699083fa1bd8600c682797a478a27c","schemas/prefit/p01_foundation_v375.json":"f0ca6c7544f14d8b1fabe0f98354287934ea65615b79cfdcc445e91432384c6d","schemas/prefit/prefit_pass_v375.json":"ca67c9c4de38aabad60b6664ec87fb18152804ea2b307d7cd46c5b99e808aa1e","schemas/prefit/time_ontology_v375.json":"210b965aff3079b9509dfd1d38a6ebcb8e4840e0931a76d247b65589ec8e3eda","schemas/prefit/truth_evidence_roles_v375.json":"de2b4cd0f66a8a0bcdbd12df9ea31ee4f2a5a5b2567113d54ed66197c7c922d6","src/kden_v375/prefit/__init__.py":"0abcecdebad671cc4f7d0af13133a2c34a8219092211eb5ffd94c8ede67d463f","src/kden_v375/prefit/p01_foundation.py":"7e496301d64e7a75132379c84fd6d3e5f8badc870d1d4d6099e2f4dbc8421f8c","src/kden_v375/prefit/records.py":"3cc6f83542a82f1f671876d968fa7016f96556d734a93dbd9477962b509bafd3"},"authority_hashes":{"ACQUISITION_BUILD_LOCK":"1ac318d288530f12790ac6c5c39385e5464510dc1ac6a6f9e5dbf3e5b262ff74","ACQUISITION_RUNTIME_LOCK":"694a338ad6276028afb710c90ececae504006fc7d1d0cbc2d0e2d9a00f5182b7","GOVERNING_PLAN":"07de6086fc2de0f31b8cdcf9d999421229a8b5a9d3a59ee100d9a72ea1e8ed00","ISSUE_VIEW_CONTRACT":"2f0b0bf31ce05588e5ceb5152afeea5fbb4392dac055719b88ff78ba7c65ac9c"},"completed_at_utc":"2026-09-23T21:43:34.350344Z","gate_evidence":{"acquisition_environment_locks_copied_without_mutation":true,"clock_ontology_encoded":true,"environment_successor_is_separate_and_versioned":true,"feature_rows_materialized":0,"final_acquisition_and_freeze_verified":true,"fold_assignments_created":0,"fold_choices_deferred_to_p07":true,"governing_v2_plan_bound":true,"models_fitted":0,"network_requests_made":0,"new_artifact_roots_do_not_overlap_frozen_archive":true,"object_primary_keys_encoded":true,"rafm_adapter_does_not_define_substrate":true,"runtime_isolation":{"absolute_user_paths_found":0,"denied_import_prefixes":["kden35","kden_panel"],"legacy_runtime_references_found":0,"package_root":"src/kden_v375"},"sealed_holdout_role_preserved":true,"step_07_predecessor_verified":true,"step_08_predecessor_verified":true,"tail_policy_encoded_without_pending_maturity_exclusion":true,"target_value_files_read":0,"truth_evidence_roles_and_date_groups_encoded":true},"predecessor_hashes":{"ACQUISITION_FREEZE":"291cfc543f41fce327812e4453e2a56688eb1145ec19fc8193242b647de4c320","KDEN_V375_ACQUISITION":"66c58ff231b1382c0a00e4aae0ae32c93e3c48255ce8ab3aa8a444c20cc37c1a","R14":"0852fea463aaad9b4b65ce5c103c45605a0b13ccd338914911b025b1aff8ecfb","STEP_07":"5d66348c7dc7bbba5beb4eb3f27a9e1b847c4e15abc4646da6f8c9849b8928c5","STEP_08":"2d525d3e7949adcb5e64781c858e3b7f2f7be7072ec917bd88eea087dbc4f85e"},"record_sha256":"1e0e6a4c62e400a9c7bd682923868cb62bde7f879de7167ecd91a041df2be8f1","run_id":"kdenv375-p01-ordinary-20260923T214115Z-foundation","schema_version":"KDEN_V375_PREFIT_PASS_V1","stage_id":"PREFIT_P01","status":"PASS"}
