{"artifact_hashes":{"config/prefit/p02_truth_v375.json":"a7609e9e3f13d63ecaefc58063633e699d160cd32a2c3ba976bde11a59cdb662","reports/prefit/P02_OWNER_RUNBOOK.md":"871bdfac03a2a879ac49aefbf0374b7cf3dbacf84d2a624a67ed76eb84d4c38e","schemas/prefit/p02_run_state_v375.json":"cab656811d102f57f9099e09949effe90dacdd3069cbee521f5e31e6146eb4c1","schemas/prefit/truth_adoption_manifest_v375.json":"cc2dea1005a0eb4d9fb18a08cfc4171c47e21d7c0abfcb5ac82840319526c041","schemas/prefit/truth_catalog_v375.json":"88bf93ca53460d64e70c816fce92d061036bd0bcd19247aad0ff90b2a6328fd3","src/kden_v375/prefit/p02_rules.py":"8f173b82a9a297fba30b33ae32d17b91d26f6d508ce4b068b424bafc6f36c55f","src/kden_v375/prefit/p02_truth.py":"3aeb3f5923c602aaacbdff50787486951ca7ba43716a5073d92832428b0314fc","truth/kden_tmax/v1":"42f250934906c65ed6b2b1ad9649ef62d90e26b62b64111a1bf345a70ffaaae4"},"authority_hashes":{"ADOPTION_MANIFEST":"e1707007242d108f31a34a11f3e1ab7c8de3d2d2c166d25d72507c7afd423daf","TAIL_MANIFEST":"dfe3dc6799a34e864142d46d7de363e21b0bfe7f6ef6ca750c7dde0eb7e7e978","TRUTH_CATALOG":"762c5778aceeff517ce2f5b2eb2ef2f3890808de3744efa5ef7e6b669d500773"},"completed_at_utc":"2026-09-23T22:26:09.422980Z","gate_evidence":{"adoption":{"deep_file_hashes_checked":0,"known_authority_hashes_checked":7,"manifest_file_count":7139},"catalog":{"development_rows":1710,"development_supervised_labels":1707,"row_count":2080,"sealed_holdout_rows":365,"status_counts":{"audited":1705,"audited_guarded_exception":2,"sealed_holdout":365,"tail_audited":5,"unresolved":3},"tail_rows":5},"legacy_runtime_dependency_created":false,"network_tail_dates":5,"pending_maturity_exclusion_applied":false,"predecessor_record_sha256":"1e0e6a4c62e400a9c7bd682923868cb62bde7f879de7167ecd91a041df2be8f1","runtime_isolation":{"absolute_user_paths_found":0,"denied_import_prefixes":["kden35","kden_panel"],"legacy_runtime_references_found":0,"package_root":"src/kden_v375"},"sealed_holdout_values_read":false,"tail_status_counts":{"auto_audited_cli_cf6_unanimous":5},"truth_and_weather_features_physically_separate":true,"truth_release_id":"KDEN_V375_TRUTH_EVIDENCE_V1"},"predecessor_hashes":{"PREFIT_P01":"1e0e6a4c62e400a9c7bd682923868cb62bde7f879de7167ecd91a041df2be8f1"},"record_sha256":"40ff18bbac4c927ae600fd54026671493f4e68e5e0d65cdf07374965837cf607","run_id":"kdenv375-p02-owner-full-20260923T222006Z-truth-adoption","schema_version":"KDEN_V375_PREFIT_PASS_V1","stage_id":"PREFIT_P02","status":"PASS"}
