{"artifact_hashes":{"config/prefit/p04_features_v375.json":"841adad85a9b0b3ef9b9677b079012a33e96ff721663310767af46d215b200aa","reports/prefit/P04_OWNER_RUNBOOK.md":"e30d6f16ca6ca22e03b4d540069a73ed87932717b15658067d30bdaa517578fc","reports/prefit/P04_UNIVERSAL_FEATURE_CONTRACT_REPORT.md":"5149419a57d8c9a90eb7910012eab25a7bf7d10a8f655b8c8b990a9547fe618e","schemas/prefit/deterministic_feature_panel_v375.json":"473d639e50c246c0544ade8ed107d9b0e938de385a08088cc843addc50cd184e","schemas/prefit/p04_feature_registry_v375.json":"16c8379d40b97d22d394cee64e001ce5c3ababcd3cfd46fa86ea8a6d88ec9c3c","src/kden_v375/prefit/p04_features.py":"cdc8da8908f64377ff1d772cd854c97d6b707dd027031dce6a407bf95696c813","universal_issue_state/v1/registries/universal_feature_registry_v1.json":"e41d78a122be15a01986f0b914518209843108062313d7d55f62e308d37aaf65"},"authority_hashes":{"ISSUE_VIEW_CONTRACT":"2f0b0bf31ce05588e5ceb5152afeea5fbb4392dac055719b88ff78ba7c65ac9c","P03_ISSUE_SPINE":"c23c7276d9dea07511d58794b444c278d550bf87c74c9b6126ef91d431287b29","P03_SELECTED_CYCLES":"4e65220bb91480c660cdbd073cdbe99bb08938fd8e65f29bcfdb2e099977ff0e","R14_FIELD_STATE_SCHEMA":"04a7e8d526bd19f003cc6ff1938b7b6b5cebe4168ae37509ab0ce1d09cde2602","R14_H14_TERRAIN_SUPPORTS":"2bbdd401f821f5a868e880ef92f89d252956a555be26ed2be87683329b81b7a6","R14_HOURLY_REGISTRY":"5bb048c7c9fe7f8c92e6d97e43cca71ec73cde2656edd97250540d7147eafb89","R14_SPATIAL_CONTRACT":"e81b055026172bbea119c6dc5787a6950ad5b53fd0c92cb7cc8ed197fd8f7d1c","R14_SPATIAL_GEOMETRY":"923bdd93629f776d22dd388a2d0174f109ac915f5e827570bbd52653d1cf68b0","R14_SUBHOURLY_REGISTRY":"1241add588f02fc6e2919ded74c0763ce6358a52034f056aa29a3e616efe7faa","STEP08_ACCEPTANCE":"d2468c73cc5edaac269c8e3c700aacc37cc15c0f1159a14b194da8e88693a224"},"completed_at_utc":"2026-09-24T02:49:00.386949Z","gate_evidence":{"bounded_acceptance":{"case_count":7,"case_ids":["ordinary","dst_spring_forward","confirmed_remote_missing","snow","convective","dry_heating","mixing_downslope"],"confirmed_remote_missing_h16_remaining_count":1,"coordinate_eras":{"2021-11-21":"KDEN_COORD_20040105","2021-11-22":"KDEN_COORD_20211122"},"h14_coordinate_era_supports_verified":true,"h38_fh00_zero_duration_verified":true,"h38_fh01_preceding_hour_verified":true,"network_requests_made":0,"spring_forward_dates_checked":["2021-03-14","2022-03-13","2023-03-12","2024-03-10","2025-03-09","2026-03-08"],"strict_missing_aggregate_is_null":true,"truth_rows_read":0},"cycle_stitching_allowed":false,"derivation_id":"KDEN_V375_DETERMINISTIC_FEATURES_V1","feature_count":433,"feature_family_counts":{"clock":14,"derived":13,"missingness":69,"revision":65,"spatial":96,"static_spatial":5,"trajectory":163,"trajectory_support":8},"full_history_rows_materialized":0,"interpolation_allowed":false,"network_requests_made":0,"panel_schema_id":"KDEN_V375_DETERMINISTIC_FEATURE_PANEL_V1","predecessor_record_sha256":"c1201500ecfd5ed6eac60d45889c4b7ecdd2620c76998c00a1769531c9479f3b","registry_id":"KDEN_V375_UNIVERSAL_FEATURE_REGISTRY_V1","runtime_isolation":{"absolute_user_paths_found":0,"denied_import_prefixes":["kden35","kden_panel"],"legacy_runtime_references_found":0,"package_root":"src/kden_v375"},"strict_aggregate_missingness":true,"truth_rows_read":0},"predecessor_hashes":{"PREFIT_P03":"c1201500ecfd5ed6eac60d45889c4b7ecdd2620c76998c00a1769531c9479f3b"},"record_sha256":"70515a2e73fbe0cef9775d01a566fbbd03f10e81978de3d96a728e4615227dc2","run_id":"kdenv375-p04-ordinary-20260924T024634Z-feature-contract","schema_version":"KDEN_V375_PREFIT_PASS_V1","stage_id":"PREFIT_P04","status":"PASS"}
