{"artifact_hashes":{"config/prefit/p07_rafm_experiment_v375.json":"b49ca0741f2a1f4bb409682d73057e57fbfde863464277a3ab89c49f50fba920","folds/kden_v375/v1/date_roles.parquet":"be4dd31b39ebfcf2d4067d1555eb5c461a9a2a9e4359aae4888fdfa05033540b","folds/kden_v375/v1/fold_manifest.json":"4a413668e6d4f8d065ee1156a3022c19e5a5cb15adcd18d01a7b38612ae28d58","folds/kden_v375/v1/inner_folds.parquet":"e0a40aaa5dc0fe717fbec0f3a1455223bf48a7f050deb7ca16947b9df5095315","folds/kden_v375/v1/outer_folds.parquet":"42b1086b9383504c23102cb988c823f212ce43f1606989018f3e3f837dd1d50e","modeling/experiments/rafm_v1/adapters/adapter_registry.json":"8da4751e6762a6dd5e0f2dac2d9767273059e1a9d99c0e8e457d2150921de9fe","modeling/experiments/rafm_v1/adapters/issue_model_index.parquet":"b5b434481f7f48a5d9e7c47cc6aa64a6383df1bf2ec1bcadf7dae339f3132782","modeling/experiments/rafm_v1/manifests/p07_experiment_freeze.json":"5f7c93b6498a130f38568e044aba035cf3bfec6e39bf5ec341ff88e395147922","prefit_runs/kdenv375-p07-owner-full-20260924T231631Z-rafm-experiment-freeze/p07/checkpoints":"eb72bdb750e5dd7f262b8fd708159fe97056a82f46f004ed54d67d1e7a2de241","prefit_runs/kdenv375-p07-owner-full-20260924T231631Z-rafm-experiment-freeze/p07/progress/completions.jsonl":"7b3313874d36b4be44e8eb6e545201217e02e4bbad5776680ac401b457fb1c5e","reports/prefit/P07_CONTAMINATION_HOLDOUT_REPORT.md":"6ff749f63e3473551c4e8788dbcffda253537d1ef8169631c870972d508208c4","reports/prefit/P07_OWNER_RUNBOOK.md":"42d571f65ac95165004510a018f9ec6f664b9250b0e243e1da7f467a76478e9c","reports/prefit/P07_SCIENTIFIC_DECISIONS.md":"828d992ef987b8931c42eeda1708e191ee4c24b4eca75ea2ba4f98d133825acb","schemas/prefit/p07_experiment_contract_v375.json":"95e48c30224c763c87f3c1761e9083c33ac73f93976a6b47f7e5e141ed0bc278","schemas/prefit/p07_experiment_freeze_v375.json":"9e500293a8015577fc6e81d4036219e66288edd5e982fe7c4df9f74a1ae4b4a1","schemas/prefit/p07_fold_registry_v375.json":"3b279bf42b05894ae85c043a1db49ed72e3bd58caefa5adab628ba0b547fb0e9","schemas/prefit/p07_model_adapter_v375.json":"9416a276383cd9d0a189013a58e8743c69a0aaed8a653f80097ffad1af7002e9","schemas/prefit/p07_modeling_boundary_pass_v375.json":"bd7cd2c66088413834b85954d9132d00a125ed79d6224b5268243393a99d2c85","schemas/prefit/p07_run_state_v375.json":"80160492d9e6d637573be804e59c3bb923aeae9e0bbbbf66fb0570f351921d91","src/kden_v375/prefit/p07_experiment.py":"340047cbf0bfa0a9e1ef2ebf4a73460b043130027275d7b5cbbdaf7367fb308f","state/KDEN_V375_MODELING_BOUNDARY_PASS.json":"ddee0a59c6f9064ab70f99f94bc52bcfbe19faf01df25094810a2842373d841e","tests/unit/test_prefit_p07_experiment.py":"79129be1ca427b25b03be19ef89bc0ae83c7bd9a8b1b680bab1795195405086d"},"authority_hashes":{"FEATURE_REGISTRY":"e41d78a122be15a01986f0b914518209843108062313d7d55f62e308d37aaf65","P06_FINAL_PASS":"45d226fe8e23fc4291bda55cac6736806f5a77b3308970eaa77d4b7a909f6dd5","P06_FREEZE":"9043b5dcb69ccfb143217ab657022f85f1750a1460e4011269526ebb08b52af6","P07_CONTRACT":"b49ca0741f2a1f4bb409682d73057e57fbfde863464277a3ab89c49f50fba920","P07_EXPERIMENT_FREEZE":"c966a0f359001ac332bf7dd6ea2afad695204987ba8e6dc2a3d291efaa024332","P07_MODELING_BOUNDARY_PASS":"47390c33f691c5fd6635c81c9b9e609d557a4557a4dc5566da54be450c00da11","PREFIT_P02":"40ff18bbac4c927ae600fd54026671493f4e68e5e0d65cdf07374965837cf607","TRUTH_CATALOG":"762c5778aceeff517ce2f5b2eb2ef2f3890808de3744efa5ef7e6b669d500773"},"completed_at_utc":"2026-09-24T23:19:19.244584Z","gate_evidence":{"exact_time_analog_default_frozen":true,"experiment_release_id":"KDEN_V375_RAFM_EXPERIMENT_V1","four_way_final_report_frozen":true,"generalist_and_specialist_contracts_frozen":true,"holdout_opened":false,"holdout_opening_procedure_frozen":true,"model_fits_performed":0,"neighboring_time_is_separate_challenger":true,"nested_inner_fold_instances":15,"nested_oof_gate_training_required":true,"network_requests_made":0,"owner_contract_approval_verified":true,"runtime_isolation":{"absolute_user_paths_found":0,"denied_import_prefixes":["kden35","kden_panel"],"legacy_runtime_references_found":0,"package_root":"src/kden_v375"},"sealed_holdout_values_read":false,"seasonal_coverage_reported":true,"target_day_grouped_outer_folds":3,"target_free_adapter_rows":118536,"truth_values_materialized_in_folds_or_adapters":false},"predecessor_hashes":{"PREFIT_P06":"9f420b8625b428a8663d190a332a0958bf72e5565c37c4543f5b78808a7f4b72"},"record_sha256":"f2f46becfe219f13d3d1526786d80a29c491144b64b070470f07c92bfe1ba36e","run_id":"kdenv375-p07-owner-full-20260924T231631Z-rafm-experiment-freeze","schema_version":"KDEN_V375_PREFIT_PASS_V1","stage_id":"PREFIT_P07","status":"PASS"}
