{"artifact_hashes":{"config/prefit/p06_acceptance_v375.json":"521effb0f29d9b743372a62114dce5950192705a4499a8e193cf64f9a0680970","config/prefit/p06_feature_contract_errata_v375.json":"01fbaccbdc9cee7e191a2f4b029094c4e231e98c5d19da8b6fd7115a6de916b8","prefit_runs/kdenv375-p06-owner-full-20260924T122614Z-substrate-acceptance/p06/checkpoints":"1a3175e63a0a15b6e43c88f2927cede71af37e3287c5d78fad19a5349377455e","prefit_runs/kdenv375-p06-owner-full-20260924T122614Z-substrate-acceptance/p06/progress/completions.jsonl":"ea8822bb10a75a1a3ef705708ad413abcf2b8e37e5d7030bbc8b252242e02a0a","reports/prefit/P06_OWNER_RUNBOOK.md":"d4c287d1df61a2e674249933f0ef010842c0484be7692d30a64b704a51321e7b","reports/prefit/P06_SUBSTRATE_ACCEPTANCE_REPORT.md":"faf30d3b844c5b176bc74b3f85d6c0d19b9ba99170e3ca34b92c0fb69045ebf3","schemas/prefit/p06_feature_contract_errata_v375.json":"14d2abed88407478652f1763332c44449298202c81faa87732eebf2c548d8cde","schemas/prefit/p06_freeze_manifest_v375.json":"4fb9ad8caa72c18469009c885c8f940484b926c4ec8398040a4bd2fa612f05c8","schemas/prefit/p06_run_state_v375.json":"f786316a0f64f4305f3e1e11ea3d5d10b4fb27f4846cc13d76976a05573e0443","schemas/prefit/universal_issue_state_pass_v375.json":"1eee220d0d0aa63a807f363c3b475cf6d7fa85769d6bbdb2494dd64cf3939b66","src/kden_v375/prefit/cli.py":"2dcadcbfa208e4846469d154355c51ca737db6e92e6258bf90b212b124d110e3","src/kden_v375/prefit/p06_acceptance.py":"6a68f0156063fd5ce24ebff85370fa0ffc0e08e31ecb48041b014a8e8558c308","state/KDEN_V375_UNIVERSAL_ISSUE_STATE_PASS.json":"893ed0239bf3d870a155fd7d6baad90384b02208668980273befff8899cf58eb","universal_issue_state/v1/manifests/p06_substrate_freeze_manifest.json":"39f2dc292cde1265fb27d52989b739fe085ca15941eb521210bb133b8cc0ce99"},"authority_hashes":{"P04_FEATURE_REGISTRY":"e41d78a122be15a01986f0b914518209843108062313d7d55f62e308d37aaf65","P05_RELEASE_INDEX":"2218778725039c956f739d116810b9cc89b5354a31adf61cbe359e3ceeb608f4","P05_RELEASE_MANIFEST":"c0bf854800ee96cb29aaea4ebb3e196ec9c07fcc4b494b2cf0491dee917d6fe8","P06_FEATURE_RANGE_ERRATA":"01fbaccbdc9cee7e191a2f4b029094c4e231e98c5d19da8b6fd7115a6de916b8","P06_FREEZE_MANIFEST":"39f2dc292cde1265fb27d52989b739fe085ca15941eb521210bb133b8cc0ce99","R14_CYCLE_SCHEDULE":"7f6676d802137faba08000e2a2f93ff21079283de41246d3e3d46d894ead6f45","UNIVERSAL_ISSUE_STATE_PASS":"45d226fe8e23fc4291bda55cac6736806f5a77b3308970eaa77d4b7a909f6dd5"},"completed_at_utc":"2026-09-24T22:45:44.027511Z","gate_evidence":{"acceptance_id":"KDEN_V375_UNIVERSAL_ISSUE_STATE_ACCEPTANCE_V1","anchor_rebuild_count":7,"anchor_rebuilds_exact":true,"canonical_source_files_hashed":66558,"clock_equations_verified":true,"dst_verified":true,"dynamic_trajectory_row_count":8919597,"explicit_missing_trajectory_row_count":12,"explicit_missingness_verified":true,"feature_count":433,"feature_range_errata_count":3,"feature_range_errata_id":"KDEN_V375_P06_FEATURE_RANGE_ERRATA_V1","feature_range_errata_names":["derived_dewpoint_depression_future_first_k","support_wrfsfcf_retained_start_offset_minutes","support_wrfsubhf_retained_start_offset_minutes"],"feature_row_count":118536,"issue_row_count":118536,"issue_time_availability_verified":true,"lead_horizon_interval_units_verified":true,"madis_rows_read":0,"market_rows_read":0,"model_fits_performed":0,"model_neutral_leakage_scan":{"feature_columns_scanned":442,"fold_or_prediction_leakage_found":0,"forbidden_predictor_tokens":["truth","y_audited","target_value","market","kalshi","settlement","madis","outcome","label","fold","prediction"],"madis_leakage_found":0,"market_leakage_found":0,"outcome_leakage_found":0,"trajectory_columns_scanned":36,"truth_leakage_found":0},"network_requests_made":0,"release_id":"KDEN_V375_UNIVERSAL_ISSUE_STATE_V1","right_open_windows_verified":true,"runtime_isolation":{"absolute_user_paths_found":0,"denied_import_prefixes":["kden35","kden_panel"],"legacy_runtime_references_found":0,"package_root":"src/kden_v375"},"selection_row_count":237072,"spatial_and_coordinate_era_rules_verified":true,"static_trajectory_row_count":1,"substrate_freeze_record_sha256":"9043b5dcb69ccfb143217ab657022f85f1750a1460e4011269526ebb08b52af6","target_day_count":2080,"target_year_partition_count":6,"total_trajectory_row_count":8919598,"truth_value_rows_read":0,"universal_issue_state_pass_sha256":"45d226fe8e23fc4291bda55cac6736806f5a77b3308970eaa77d4b7a909f6dd5"},"predecessor_hashes":{"PREFIT_P05":"7e1366d32972aa492ae1064c354bfb0261401f59a16e16a26e12a65df96c4132"},"record_sha256":"9f420b8625b428a8663d190a332a0958bf72e5565c37c4543f5b78808a7f4b72","run_id":"kdenv375-p06-owner-full-20260924T122614Z-substrate-acceptance","schema_version":"KDEN_V375_PREFIT_PASS_V1","stage_id":"PREFIT_P06","status":"PASS"}
